chunk_id,main_topic,chunk_title,chunk_text,src_url
od-1,Ozone Detectors,Ozone Detectors (General Description),"Air Quality & Atmospheric Ozone Detectors Ozone plays a complex role as both a protective layer in the upper atmosphere and a pollutant at ground level, and our ozone detectors help students explore this dual nature with clarity and accuracy. Designed for safety and ease of use, these detectors provide precise readings of ground-level ozone concentrations, making them ideal for environmental science labs, urban pollution studies, and field-based research. Featuring robust construction and user-friendly interfaces, our detectors are trusted by educational institutions across North America for delivering results that align with EPA and AQI guidelines, helping students engage with real-world data and environmental policy standards. Enable students to explore the science of air quality with accurate ozone detectors that provide real-time data, bridging classroom theory with real-world applications.

We believe that environmental literacy begins with access to accurate, real-world data. Our Ozone Detectors are engineered for educational use, enabling students to measure and analyze ambient ozone levels directly within their learning environments. Whether in classrooms, research labs, or outdoor campus settings, our detectors provide reliable, real-time readings that help students connect scientific theory with environmental reality. Designed with both simplicity and accuracy in mind, these systems are ideal for middle schools, high schools, colleges, and universities. Headquartered in Philadelphia, PA, we’ve built a reputation across North America as a trusted leader in delivering robust and innovative tools that educators can count on.",https://enviroeducationtools.com/air-quality-atmospheric-testers/
od-2,Ozone Detectors,Hardware for Ozone Detectors,"Precision electrochemical or UV-based ozone sensors
Product Category: Ozone Gas Detectors – Used for detecting ozone levels in science classrooms and environmental learning labs.
Weatherproof casing for indoor/outdoor use
Product Category: Other Environmental Testers – Designed for durable, educational fieldwork and indoor installations in schools and research facilities.
Rechargeable battery or AC power options
Product Category: Industrial Gas Detectors – Supports continuous operation and data recording in varied environmental education settings. https://www.gaoatek.com/collections/ozone-gas-detectors

https://www.gaoatek.com/collections/other-environmental-testers

https://gaotek.com/category/environmental/industrial-gas-detectors/",https://enviroeducationtools.com/air-quality-atmospheric-testers/
od-3,Ozone Detectors,Software and Cloud Services for Ozone Detectors,"User-friendly desktop dashboard for data logging
Real-time graph visualization
Export options for Excel, CSV, and Google Sheets Optional cloud syncing for remote data access
Secure data storage for historical analysis
API access for education platform integrations",https://enviroeducationtools.com/air-quality-atmospheric-testers/
od-4,Ozone Detectors,Key Features of Ozone Detectors,"Real-time ambient ozone detection (ppb/ppm)
Automatic calibration alerts
Data logging with timestamp and geo location
Visual and audible alarms for threshold breaches
LCD screen with intuitive interface
Plug-and-play installation with minimal training required",https://enviroeducationtools.com/air-quality-atmospheric-testers/
od-5,Ozone Detectors,Integrations for Ozone Detectors,"Seamlessly integrates with learning platforms such as Google Classroom and Microsoft Teams
Compatible with MacOS, Windows, and Chromebooks
Can connect with external sensors for comprehensive air quality profiling
Works with local network or via cellular hotspot for cloud syncing",https://enviroeducationtools.com/air-quality-atmospheric-testers/
od-6,Ozone Detectors,Benefits for Educators & Students (Ozone Detectors),"Supports STEM curriculum with real-world experiments
Promotes student awareness of environmental and health issues
Prepares learners for careers in environmental science and policy
Helps institutions meet green school standards
Offers scalable deployment across classrooms, labs, or districts
Backed by responsive customer support and expert guidance",https://enviroeducationtools.com/air-quality-atmospheric-testers/
od-7,Ozone Detectors,Applications for Ozone Detectors,"High school chemistry and biology labs
College-level environmental science courses
Community air monitoring projects
School green initiatives and climate programs
Field trips and outdoor learning modules",https://enviroeducationtools.com/air-quality-atmospheric-testers/
od-8,Ozone Detectors,Industry Standards (Ozone Detectors),"EPA Air Quality Index (AQI) Guidelines
OSHA Indoor Air Quality Standards
ASTM D5157 Ozone in Ambient Air Standard
CSA C22.2 Safety Standards for Measurement Instruments",https://enviroeducationtools.com/air-quality-atmospheric-testers/
od-9,Ozone Detectors,Case Study: U.S. (California High School Environmental...,"U.S. (California High School Environmental Lab)
A Southern California high school incorporated our ozone detectors into its AP Environmental Science curriculum. Students used real-time ozone data to analyze local air quality trends and presented findings to their school board, influencing discussions about creating low-emission zones on campus.

U.S. (New York City Community College)
A community college in NYC used our detectors to support a semester-long project where students compared ozone levels across five boroughs. The data helped identify pollution hotspots and sparked a campus-wide conversation about sustainable transportation.

Canada (Ontario Secondary School)
In partnership with the school’s science department, a public high school in Ontario integrated our detectors into its Grade 11 Environmental Science program. Students collected ozone readings near bus drop-off areas and used the data to suggest timing adjustments that improved air quality during peak hours.",https://enviroeducationtools.com/air-quality-atmospheric-testers/
cmd-1,Carbon Monoxide Detectors,Carbon Monoxide Detectors (General Description),"Air Quality & Atmospheric Carbon Monoxide Detectors Carbon monoxide is an invisible, odorless, and potentially deadly gas—making it essential to teach students how to detect and understand its presence in our environment. Our CO detectors are specially developed for educational applications, allowing safe, controlled study of combustion emissions, indoor air quality, and industrial pollution sources. Each unit undergoes a strict quality assurance process to ensure safety, precision, and durability in classroom and lab use. Supported by our team of experts, these detectors come with curriculum guides to help educators effectively integrate carbon monoxide analysis into broader lessons on environmental health and safety. Designed for classrooms and labs, these detectors combine safety with hands-on environmental science learning.

We understand that ensuring a safe and conducive learning environment is essential for educational success. Our Carbon Monoxide Detectors are designed specifically for educational settings to monitor air quality and prevent exposure to harmful gases. Carbon monoxide (CO) is a colorless, odorless gas that can cause serious health issues, especially in enclosed environments like classrooms and laboratories. With our advanced detectors, educators can easily track CO levels, ensuring that the air quality in their classrooms is safe for both students and staff. These detectors play a crucial role in fostering a healthy, sustainable learning space, providing real-time data and early warnings when CO concentrations exceed safe limits.",https://enviroeducationtools.com/air-quality-atmospheric-testers/
cmd-2,Carbon Monoxide Detectors,Hardware for Carbon Monoxide Detectors,"Sensors: Advanced CO sensors that detect carbon monoxide levels with high accuracy and reliability. Our Carbon Monoxide Gas Detector provides reliable detection solutions tailored for classroom safety and lab monitoring.
Display: LED or digital readout for easy visibility and real-time monitoring. Our Environmental Test Instruments include integrated displays that simplify data interpretation for educational staff.
Battery/Power Supply: Rechargeable batteries or plug-in adapters for consistent power supply. Our Temperature Data Loggers are known for their efficient power systems, making them ideal for continuous environmental monitoring.
Alarms: Audio and visual alerts to notify users of elevated CO levels. Our Sound Level Meters & Calibrators help ensure alarm output is clear and compliant for school environments. https://www.gaoatek.com/product-category/commercial-gas-detectors/

https://www.gaoatek.com/product-category/environmental-test-instruments/ 

https://www.gaoatek.com/product-category/temperature-data-loggers/

https://www.gaoatek.com/product-category/sound-level-meters-calibrators/",https://enviroeducationtools.com/air-quality-atmospheric-testers/
cmd-3,Carbon Monoxide Detectors,Software and Cloud Services for Carbon Monoxide Detectors,"Data Logging: Automatically records CO levels over time for later analysis and reporting.
Alerts & Notifications: Integrated software to send alerts via mobile or desktop when CO levels reach hazardous levels. Data Synchronization: Cloud storage for real-time data monitoring and access from multiple locations.
Remote Monitoring: Secure cloud-based dashboards for remote access to CO data across educational campuses.",https://enviroeducationtools.com/air-quality-atmospheric-testers/
cmd-4,Carbon Monoxide Detectors,Key Features of Carbon Monoxide Detectors,"Real-Time Monitoring: Continuously monitors and displays carbon monoxide levels in the classroom or school facility.
Instant Alerts: Audible and visual alarms when CO concentrations exceed safety thresholds.
Data Logging and Analysis: Records CO levels for easy tracking and analysis over time, helping institutions monitor air quality.
Cloud Integration: Seamlessly integrates with cloud services for remote monitoring and data storage.
Energy Efficient: Low power consumption and long-lasting sensors for extended periods of operation.",https://enviroeducationtools.com/air-quality-atmospheric-testers/
cmd-5,Carbon Monoxide Detectors,Integrations for Carbon Monoxide Detectors,"Smart Building Systems: Integrates with existing smart building or environmental monitoring systems.
Mobile Apps: Compatible with mobile apps for remote monitoring and notifications.
Data Management Systems: Syncs with school or district-wide data management platforms for streamlined operation.

Our Carbon Monoxide Detectors are designed to be compatible with most classroom and school environments, including:

School Buildings
Classrooms
Laboratories
Libraries and Common Areas
Offices and Staff Rooms",https://enviroeducationtools.com/air-quality-atmospheric-testers/
cmd-6,Carbon Monoxide Detectors,Benefits for Educators & Students (Carbon Monoxide Detectors),"Health & Safety: Reduces the risk of carbon monoxide poisoning by providing early warnings.
Cost-Efficient: Helps reduce the cost of health-related issues by preventing exposure to toxic gases.
Improved Air Quality Management: Facilitates the effective management of air quality, creating a healthier learning environment.
Easy to Use: Simple setup and intuitive interface make it ideal for educational environments.
Compliance Support: Helps meet safety regulations and standards for schools and educational institutions.",https://enviroeducationtools.com/air-quality-atmospheric-testers/
cmd-7,Carbon Monoxide Detectors,Applications for Carbon Monoxide Detectors,"Classroom Safety: Monitor CO levels in real-time to ensure student and staff safety during classes.
Science Labs: Ensure that laboratory environments are safe for students conducting experiments involving combustion or gases.
Indoor Air Quality: Used in areas like libraries, offices, and common areas to maintain safe air quality levels.
Emergency Preparedness: Provide early warnings that allow for prompt action in case of unsafe air quality.",https://enviroeducationtools.com/air-quality-atmospheric-testers/
cmd-8,Carbon Monoxide Detectors,Industry Standards (Carbon Monoxide Detectors),"U.S. Regulations:
OSHA (Occupational Safety and Health Administration) Standards for Carbon Monoxide Exposure
EPA (Environmental Protection Agency) Standards for Air Quality
NFPA (National Fire Protection Association) 720: Standard for the Installation of Carbon Monoxide (CO) Detection and Warning Equipment
Canadian Regulations:
CSA (Canadian Standards Association) B149.1-10 Natural Gas and Propane Installation Code for CO Monitoring in Schools",https://enviroeducationtools.com/air-quality-atmospheric-testers/
cmd-9,Carbon Monoxide Detectors,Case Study: U.S. Case Study – K-12...,"U.S. Case Study – K-12 School District (California)
A large K-12 school district in California implemented Carbon Monoxide Detectors across all of its schools to improve air quality and ensure the safety of over 10,000 students and staff. By integrating real-time monitoring and data logging, the district significantly reduced the risk of CO exposure incidents.

U.S. Case Study – University Campus (New York)
A university in New York adopted Carbon Monoxide Detectors in its science labs and classrooms, creating a safer environment for students and faculty. With cloud-based data synchronization, administrators were able to monitor CO levels across multiple campus buildings and ensure compliance with local safety regulations.

Canadian Case Study – High School (Toronto)
A high school in Toronto used Carbon Monoxide Detectors in its indoor sports facilities and libraries. The system’s data logging and alerting features helped the school respond quickly to rising CO levels during peak usage times, ensuring a healthy and safe environment for students.",https://enviroeducationtools.com/air-quality-atmospheric-testers/
pm-1,pH Meters,pH Meters (General Description),"Water Quality and Hydrology pH Meters Understanding pH is fundamental in environmental science, as it affects aquatic life, chemical reactions, and water quality. Our pH meters are built for classroom durability and deliver lab-grade accuracy. Compact, user-friendly, and backed by a strict quality assurance process, they allow students to confidently measure the acidity or alkalinity of water samples in both field and lab settings. They’re an essential tool for demonstrating chemical equilibria and understanding environmental impact assessments. Educators can enhance lab exercises with real-time pH analysis, helping students draw meaningful conclusions from their experiments. Provide students with accurate, easy-to-use pH meters that transform classroom experiments into meaningful scientific exploration.

We provide industry-grade pH Meters tailored specifically for the education industry. Whether used in K-12 science labs, college-level research, or environmental field studies, our pH meters deliver dependable, accurate results in an intuitive and durable format. These tools empower students and educators to explore acidity and alkalinity across a wide range of real-world scenarios, from freshwater ecosystems to industrial runoff testing. Headquartered in Philadelphia, PA, Enviro Education Tools is a leader in providing scalable, smart environmental testing solutions that meet the rigorous demands of modern education. Backed by our commitment to innovation, quality assurance, and exceptional support, our pH meters are the perfect gateway for practical, science-based learning.",https://enviroeducationtools.com/water-quality-and-hydrology-testers/
pm-2,pH Meters,Hardware for pH Meters,"Rugged, Portable Handheld Meters
Our Environmental Test Instruments are designed for durability and portability, making them ideal for field studies and classroom demonstrations in environmental science education
Replaceable and Durable Electrode Probes
Utilizing Turbidimeters, students can measure water turbidity with precision, and the replaceable probes ensure longevity and consistent performance in various educational experiments
Backlit LCD Displays with Intuitive Interface
Our Sound Level Meters & Calibrators feature backlit LCDs, providing clear readings in diverse lighting conditions, which is essential for accurate data collection during classroom and field activities
Built-in Temperature Compensation Sensors
The Temperature Data Loggers we offer come equipped with built-in temperature compensation, ensuring accurate readings across varying environmental conditions, a critical feature for educational experiments requiring precise data https://gaotek.com/category/environmental/

https://gaotek.com/category/water-testers/turbidimeters/ 

https://gaotek.com/category/environmental/sound-level-meters/ 

https://gaotek.com/category/environmental/temperature-data-logger/",https://enviroeducationtools.com/water-quality-and-hydrology-testers/
pm-3,pH Meters,Software and Cloud Services for pH Meters,"Easy-to-use calibration software for teachers and students
On-device data logging and storage
USB or Bluetooth interface for data transfer Integration with cloud-based platforms for remote access and storage
Class-level dashboards for comparative data studies
Syncing with LMS tools for student data uploads",https://enviroeducationtools.com/water-quality-and-hydrology-testers/
pm-4,pH Meters,Key Features of pH Meters,"±0.01 pH measurement accuracy
Multi-point auto-calibration
Waterproof casing (IP67-rated) for fieldwork
Real-time data readouts with temperature display
Battery life indicators and auto shut-off
Easy-to-clean glass or polymer electrodes
Onboard memory for storing multiple test sessions",https://enviroeducationtools.com/water-quality-and-hydrology-testers/
pm-5,pH Meters,Integrations for pH Meters,"Seamless data export to Microsoft Excel and Google Sheets
Integration support with Google Classroom and other LMS platforms
Optional compatibility with LabQuest interfaces for advanced analysis

Windows and macOS devices
USB-A, USB-C, and Bluetooth 4.0+
Standard 3-point pH buffer calibration solutions
Smartboards and digital displays for group demonstrations",https://enviroeducationtools.com/water-quality-and-hydrology-testers/
pm-6,pH Meters,Benefits for Educators & Students (pH Meters),"Designed for education with student-friendly interfaces
Affordable and scalable for classroom or district-wide deployment
Enhances science curriculum with real-world data collection
Supports STEM learning objectives and inquiry-based teaching
Minimal maintenance and long-term durability",https://enviroeducationtools.com/water-quality-and-hydrology-testers/
pm-7,pH Meters,Applications for pH Meters,"Classroom demonstrations on acids and bases
Environmental water sampling projects
Chemistry lab experiments on pH reactions
Agricultural water testing (irrigation suitability)
Municipal or school-based water quality monitoring",https://enviroeducationtools.com/water-quality-and-hydrology-testers/
pm-8,pH Meters,Industry Standards (pH Meters),"ASTM D1293
EPA 150.1
APHA Standard Methods 4500-H+
NSF/ANSI 61
CAN/CSA-ISO 10523",https://enviroeducationtools.com/water-quality-and-hydrology-testers/
pm-9,pH Meters,Case Study: California Public School District A...,"California Public School District
A Southern California school district implemented Enviro Education Tools’ pH meters in over 40 middle school classrooms. The result: a 35% increase in student engagement during water chemistry lessons, and the integration of real-time fieldwork in school garden programs.

 Community College in Ohio
An Ohio community college used our pH meters during environmental field labs near the Great Lakes. With Bluetooth data syncing, instructors easily tracked individual and group data, aligning with their course’s digital-first approach.

Canada Ontario STEM Academy
An independent STEM academy in Ontario integrated our meters into a watershed education module. Students used pH data to evaluate the impact of urban runoff on a local river, leading to a class-led sustainability project and local policy discussions",https://enviroeducationtools.com/water-quality-and-hydrology-testers/
tm-1,Turbidity Meters,Turbidity Meters (General Description),"Water Quality and Hydrology Turbidity Meters Turbidity meters from Enviro Education Tools are essential for analyzing water clarity—a key indicator of water health. These meters help students visualize how sediment, plankton, and pollutants affect light penetration in aquatic systems. With quick calibration and reliable readings, they support a wide range of learning objectives in environmental chemistry and hydrology. Educators can use them to spark discussions on erosion, runoff, and watershed management. Their portability and simple interface make them ideal for both classroom demonstrations and field-based water testing projects Reliable and easy to use, these instruments help learners explore the impact of pollution, sediment, and filtration on aquatic ecosystems.

We specialize in delivering purpose-built Turbidity Meters that bring real-world water analysis into the classroom and professional environments. Turbidity, or the cloudiness of water, is a critical indicator of environmental health, and our meters allow students, technicians, and researchers to measure it with pinpoint accuracy. Whether you’re testing lakes, rivers, tap water, or treatment systems, our instruments deliver fast, dependable results. Headquartered in Philadelphia, PA, we lead with innovation, rigorous quality assurance, and exceptional support to ensure that our partners in education and industry can rely on our solutions in every application.",https://enviroeducationtools.com/water-quality-and-hydrology-testers/
tm-2,Turbidity Meters,Hardware for Turbidity Meters,"Handheld and benchtop turbidity meters with waterproof casing
Turbidimeters are used for accurate turbidity measurement in field and lab conditions, ideal for environmental science education.
Optical sensors compliant with ISO 7027 and EPA 180.1
Colorimeters enhance water quality analysis by detecting specific color-based indicators used in classroom demonstrations and lab experiments.
Auto-ranging capabilities with high and low turbidity detection
Environmental Test Instruments support a broad range of hydrology tests and dynamic turbidity conditions in education-based water studies.
Rechargeable battery or USB-powered options
Temperature Data Loggers provide portable and power-efficient operation for continuous environmental monitoring in remote educational settings. https://www.gaotek.com/turbidimeters/

https://www.gaotek.com/colorimeters/ 

https://www.gaotek.com/environmental-test-instruments/ 

https://www.gaotek.com/temperature-data-loggers/",https://enviroeducationtools.com/water-quality-and-hydrology-testers/
tm-3,Turbidity Meters,Software and Cloud Services for Turbidity Meters,"On-device intuitive interface for quick calibration and data logging
Real-time graphing and exportable CSV reports
Data visualization tools for classroom or lab use Remote data sync via USB or Bluetooth
Cloud-based dashboards for historical tracking and analytics
Secure access for educators or lab managers to monitor long-term trends",https://enviroeducationtools.com/water-quality-and-hydrology-testers/
tm-4,Turbidity Meters,Key Features of Turbidity Meters,"Digital readouts with high-resolution display
EPA and ISO method support
Built-in memory for up to 2000+ readings
One-touch calibration and self-diagnostic checks
Dual-beam optical systems to reduce interference
Field kits available for portable testing",https://enviroeducationtools.com/water-quality-and-hydrology-testers/
tm-5,Turbidity Meters,Integrations for Turbidity Meters,"Compatible with Google Sheets, Excel, and LabLogger
Easily connect to data acquisition systems (DAQs) and science education platforms
Bluetooth and USB connectivity for seamless data transfer

Works with PC, Mac, Chromebooks
Cross-platform software utility for data extraction
Operates in diverse environments: freshwater, brackish, or wastewater
Compatible with other Enviro Education Tools systems for combined environmental monitoring",https://enviroeducationtools.com/water-quality-and-hydrology-testers/
tm-6,Turbidity Meters,Benefits for Educators & Students (Turbidity Meters),"For Educators: Enhances STEM learning with hands-on experimentation
For Researchers: Ensures precision data for environmental studies
For Industry: Streamlines compliance reporting and water quality management
Rugged designs for field or lab work
Minimal training required with intuitive interface",https://enviroeducationtools.com/water-quality-and-hydrology-testers/
tm-7,Turbidity Meters,Applications for Turbidity Meters,"K–12 and university science labs
Field research in lakes, rivers, and wetlands
Water treatment plant operations
Aquaculture and fishery monitoring
Environmental compliance testing",https://enviroeducationtools.com/water-quality-and-hydrology-testers/
tm-8,Turbidity Meters,Industry Standards (Turbidity Meters),"EPA 180.1
ISO 7027
ASTM D1889
Standard Methods 2130 B
CSA B483.1 (Canada)",https://enviroeducationtools.com/water-quality-and-hydrology-testers/
