chunk_id,main_topic,chunk_title,chunk_text,src_url
paqm-1,Portable Air Quality Monitors,Portable Air Quality Monitors (General Description),"Air Quality & Atmospheric Portable Air Quality Monitors Our Portable Air Quality Monitors are compact, lightweight devices engineered to measure real-time concentrations of pollutants such as particulate matter (PM1.0, PM2.5, PM10), carbon monoxide, carbon dioxide, ozone, and volatile organic compounds (VOCs). These versatile monitors are ideal for classroom demonstrations, student-led projects, and outdoor research activities, offering students direct engagement with real-world environmental data. Designed with intuitive displays, wireless connectivity, and rechargeable batteries, these monitors ensure students spend more time analyzing results and less time troubleshooting technology. Designed for schools and universities, these portable monitors provide accurate insights into pollution, climate, and indoor air quality challenges",https://enviroeducationtools.com/air-quality-atmospheric-testers/
paqm-2,Portable Air Quality Monitors,Hardware for Portable Air Quality Monitors,"High-accuracy gas and particulate sensors (CO₂, PM2.5, PM10, VOCs): Our Carbon Dioxide Gas Detectors are perfect for monitoring CO₂ levels in classrooms and labs, ensuring a safe learning environment. 

Rechargeable battery for portable use: The Temperature Data Loggers are ideal for mobile air monitoring tasks, offering battery-powered operation for easy use in educational settings.

Touchscreen or LCD display for on-site readings: Sound Level Meters & Calibrators provide real-time, on-site readings, enhancing interactive learning activities by giving immediate visual feedback. https://gaotek.com/category/environmental/industrial-gas-detectors/carbon-dioxide-gas-detectors/ 

https://gaotek.com/category/environmental/temperature-data-logger/ 

https://gaotek.com/category/environmental/sound-level-meters/",https://enviroeducationtools.com/air-quality-atmospheric-testers/
paqm-3,Portable Air Quality Monitors,Software and Cloud Services for Portable Air Quality Monitors,"Intuitive data logging software for trend analysis

User-friendly interface designed for students and teachers

Exportable CSV formats for extended data projects and reports Centralized cloud dashboard for device management

Remote monitoring access for educators

Automated reporting and threshold alerts",https://enviroeducationtools.com/air-quality-atmospheric-testers/
paqm-4,Portable Air Quality Monitors,Key Features of Portable Air Quality Monitors,"Real-time monitoring of multiple air quality parameters

Rechargeable and portable, ideal for fieldwork or in-class demos

Audible alerts and visual indicators for unsafe air levels

Customizable logging intervals for short- and long-term studies

Wireless data transfer for ease of use in school networks",https://enviroeducationtools.com/air-quality-atmospheric-testers/
paqm-5,Portable Air Quality Monitors,Integrations for Portable Air Quality Monitors,"Works with Google Sheets, Excel, and most data analysis tools

Integrates with environmental science curriculums across K-12 and higher education

Compatible with Chromebooks, Windows PCs, and MacOS

Easily deployable across multiple classrooms or campuses",https://enviroeducationtools.com/air-quality-atmospheric-testers/
paqm-6,Portable Air Quality Monitors,Benefits for Educators & Students (Portable Air Quality Monitors),"Encourages inquiry-based learning through real-time environmental data

Supports STEM objectives, including scientific observation, data interpretation, and hypothesis testing

Improves student engagement by connecting science to local environmental issues.",https://enviroeducationtools.com/air-quality-atmospheric-testers/
paqm-7,Portable Air Quality Monitors,Applications for Portable Air Quality Monitors,"Classroom demonstrations and experiments

Outdoor science field trips

University research projects

Science fairs and community outreach

Facility air quality awareness programs",https://enviroeducationtools.com/air-quality-atmospheric-testers/
paqm-8,Portable Air Quality Monitors,Industry Standards (Portable Air Quality Monitors),"EPA Air Sensor Guidebook 

ASHRAE 62.1: Ventilation for Acceptable Indoor Air Quality  

ASTM D6245-18  

Health Canada – Exposure Guidelines for Indoor Air Pollutants",https://enviroeducationtools.com/air-quality-atmospheric-testers/
paqm-9,Portable Air Quality Monitors,Case Study: California Public High School (USA)...,"California Public High School (USA)
A public high school in Sacramento implemented our Portable Air Quality Monitors across their science classrooms as part of a district-wide initiative to increase environmental literacy. Teachers used the monitors during wildfire season to show students how particulate matter fluctuates and tied this into discussions about health impacts and policy.",https://enviroeducationtools.com/air-quality-atmospheric-testers/
paqm-10,Portable Air Quality Monitors,Case Study: STEM Charter Academy in Texas...,"STEM Charter Academy in Texas (USA)
At a STEM-focused charter academy in Austin, our monitors were used in a semester-long project where students measured and mapped air quality across different campus zones. The findings were presented to the school board, resulting in upgraded air filters in older buildings.",https://enviroeducationtools.com/air-quality-atmospheric-testers/
paqm-11,Portable Air Quality Monitors,Case Study: University of British Columbia –...,"University of British Columbia – Environmental Education Lab (Canada)
UBC integrated our monitors into their environmental science teacher training program. Student teachers used them to design air quality labs for their practicum schools, promoting early awareness and the integration of data science into lesson planning.",https://enviroeducationtools.com/air-quality-atmospheric-testers/
cdm-1,Carbon Dioxide Meters,Carbon Dioxide Meters (General Description),"Air Quality & Atmospheric Carbon Dioxide Meters High carbon dioxide levels can negatively impact both cognitive performance and indoor air quality, making monitoring essential in academic environments. Our CO₂ meters are tailored for educational use in classrooms, science labs, and greenhouses, enabling students to track air quality changes over time and understand the critical role of ventilation in regulating CO₂ levels. Many of our meters feature integrated temperature and humidity sensors, offering a more holistic view of indoor environmental conditions. In support of our mission to deliver smart, easy-to-adopt educational tools. Ensure healthy classrooms with accurate CO₂ monitoring devices designed to promote better air quality, student focus, and overall well-being.

We offer advanced Carbon Dioxide Meters built specifically for educational settings. These devices provide real-time, accurate CO₂ level readings to support healthy indoor environments and foster awareness among students and staff. In a world increasingly focused on air quality, our meters are more than just monitoring tools—they are learning instruments. Educators use them to teach students about air quality, ventilation, human impact, and health safety, transforming scientific principles into practical experiences. Backed by our strong B2B presence across North America, we’re helping institutions elevate learning environments while ensuring safe, breathable classrooms.",https://enviroeducationtools.com/air-quality-atmospheric-testers/
cdm-2,Carbon Dioxide Meters,Hardware for Carbon Dioxide Meters,"High-accuracy CO₂ sensors (NDIR-based): Utilized in our Carbon Dioxide Gas Detectors to precisely measure CO₂ concentrations in classrooms and labs.

Portable or wall-mounted enclosure: Integrated into our Commercial Gas Detectors, allowing flexible deployment across school buildings and facilities.

Built-in temperature and humidity sensors (select models): Enabled through our Hygrometers, providing comprehensive environmental insights alongside CO₂ data for holistic classroom monitoring. https://www.gaoetek.com/products/carbon-dioxide-gas-detectors

https://www.gaoetek.com/products/commercial-gas-detectors

https://www.gaoetek.com/products/hygrometers",https://enviroeducationtools.com/air-quality-atmospheric-testers/
cdm-3,Carbon Dioxide Meters,Software and Cloud Services for Carbon Dioxide Meters,"Intuitive user interface with data logging

Configurable CO₂ thresholds and alarms

Multi-unit data aggregation (for campus-wide monitoring)

Visual trend graphing tools for student engagement Remote data access via web portal

Real-time alerts via email or SMS

Historical data archives for reporting and lesson planning

Integration-ready API for custom dashboards",https://enviroeducationtools.com/air-quality-atmospheric-testers/
cdm-4,Carbon Dioxide Meters,Key Features of Carbon Dioxide Meters,"Accurate CO₂ level detection in parts per million (ppm)

User-defined alerts when levels exceed safety thresholds

Internal memory for data logging (up to 30 days)

Temperature and humidity tracking for full indoor air quality context

Compact and durable for classroom and lab use

Quick sensor calibration with minimal maintenance

Visual indicators (LED color alerts) for air quality status",https://enviroeducationtools.com/air-quality-atmospheric-testers/
cdm-5,Carbon Dioxide Meters,Integrations for Carbon Dioxide Meters,"Compatible with most standard HVAC systems 

Seamlessly integrates with smart classrooms or BMS platforms 

Can export data to educational software and school analytics systems

Works in K-12 classrooms, university labs, vocational training centers 

Cross-platform accessibility: Windows, macOS, ChromeOS

Syncs with data science tools for STEM education modules",https://enviroeducationtools.com/air-quality-atmospheric-testers/
cdm-6,Carbon Dioxide Meters,Benefits for Educators & Students (Carbon Dioxide Meters),"Promotes awareness of indoor air quality among students 

Enables real-time decision-making about ventilation and occupancy 

Enhances environmental science curriculum with live demonstrations 

Fulfills health and safety compliance in classrooms 

Reduces illness risk related to poor ventilation or CO₂ buildup",https://enviroeducationtools.com/air-quality-atmospheric-testers/
cdm-7,Carbon Dioxide Meters,Applications for Carbon Dioxide Meters,"Classroom air quality monitoring 

Environmental science lab experiments 

Vocational training in HVAC and environmental safety 

Public health modules in higher education 

School-wide indoor air quality initiatives",https://enviroeducationtools.com/air-quality-atmospheric-testers/
cdm-8,Carbon Dioxide Meters,Industry Standards (Carbon Dioxide Meters),"ASHRAE Standard 62.1 

EPA Indoor Air Quality Guidelines 

WELL Building Standard 

CSA Z1000 Occupational Health and Safety Management 

LEED v4 Indoor Environmental Quality",https://enviroeducationtools.com/air-quality-atmospheric-testers/
cdm-9,Carbon Dioxide Meters,"Case Study: U.S. – Philadelphia, PA A...","U.S. – Philadelphia, PA
A public school district in Philadelphia implemented Enviro Education Tools’ CO₂ meters across 25 schools to ensure proper ventilation during high occupancy. The meters provided visual indicators and alerts, helping staff monitor safe learning environments. The initiative reduced indoor complaints and enhanced engagement in environmental studies.",https://enviroeducationtools.com/air-quality-atmospheric-testers/
cdm-10,Carbon Dioxide Meters,"Case Study: U.S. – Seattle, WA A...","U.S. – Seattle, WA
A charter school integrated CO₂ meters into its 7th-grade STEM curriculum. Students used live data to conduct air quality investigations, write reports, and present solutions. Teachers noted increased enthusiasm and understanding of environmental science concepts.",https://enviroeducationtools.com/air-quality-atmospheric-testers/
cdm-11,Carbon Dioxide Meters,"Case Study: Canada – Toronto, ON A...","Canada – Toronto, ON
A college of applied sciences used our CO₂ meters in HVAC technician training. Students monitored real-time air quality during simulations, gaining hands-on experience with tools used in the field. The program reported improved job readiness among graduates.",https://enviroeducationtools.com/air-quality-atmospheric-testers/
pms-1,Particulate Matter Sensors,Particulate Matter Sensors (General Description),"Air Quality & Atmospheric Particulate Matter Sensors Understanding airborne particulate matter is vital for studying pollution, air quality, and respiratory health. Our PM sensors enable students to measure and analyze common pollutants such as dust, soot, and pollen. These sensors are fully compatible with widely used STEM platforms like Arduino and Raspberry Pi, making them perfect for interdisciplinary projects that blend environmental science with electronics, coding, and data interpretation. Each sensor from Enviro Education Tools is pre-calibrated for accuracy and reliability, and we offer extensive technical support to ensure educators can focus on teaching rather than troubleshooting. Bring science to life with real-time particulate matter data, fostering awareness and critical thinking in classrooms.

Particulate Matter Sensors are engineered to bring environmental science to life in educational settings. These precision tools allow students, educators, and researchers to measure airborne particulate concentrations (PM1.0, PM2.5, and PM10) in real-time, making them ideal for interactive STEM learning, environmental health studies, and campus-wide air quality monitoring. By providing reliable and accurate air pollution data, these sensors help students understand the direct impact of particulate matter on health and climate. Our systems are compact, durable, and classroom-safe—perfect for school districts, universities, and research centers seeking hands-on, data-driven educational experiences.",https://enviroeducationtools.com/air-quality-atmospheric-testers/
pms-2,Particulate Matter Sensors,Hardware for Particulate Matter Sensors,"Laser-Scattering Sensor Modules (measuring PM1.0, PM2.5, and PM10) Utilizes our Environmental Test Instruments category to deliver highly accurate PM data for air quality analysis in educational environments. 

Educational Display Interface Units Incorporates Digital Refractometers to provide real-time visual feedback and facilitate interactive learning in classrooms and laboratories. 

Optional Solar Power Accessories for Field Research Pairs effectively with Moisture Analyzers & Meters to support autonomous, solar-powered research stations for environmental education programs. https://gaotek.com/category/environmental/digital-refractometers/


https://www.gaotek.com/moisture-analyzers-meters/",https://enviroeducationtools.com/air-quality-atmospheric-testers/
pms-3,Particulate Matter Sensors,Software and Cloud Services for Particulate Matter Sensors,"Real-time data visualization dashboard 

Historical trend analysis tools 

Alert and notification system for threshold breaches 

Intuitive web and mobile interface Secure data storage and backup Cloud-based access for multi-campus usage API access for student projects and curriculum integration Role-based access for educators, admins, and students",https://enviroeducationtools.com/air-quality-atmospheric-testers/
pms-4,Particulate Matter Sensors,Key Features of Particulate Matter Sensors,"Real-time monitoring of PM1.0, PM2.5, and PM10 Plug-and-play operation with minimal calibration Color-coded air quality indicators for easy understanding Long-term data logging and remote access Compatible with local or school-wide displays Threshold-based alerts for poor air quality days",https://enviroeducationtools.com/air-quality-atmospheric-testers/
pms-5,Particulate Matter Sensors,Integrations for Particulate Matter Sensors,"Existing weather stations Classroom science lab software School or university network infrastructure Educational analytics platforms.
Compatible with Windows, macOS, and ChromeOS devices
Mobile-friendly access on Android and iOS
Works with Google Classroom and Microsoft Teams via data plugins
Easily integrates with educational LMS systems for assignments and data submission",https://enviroeducationtools.com/air-quality-atmospheric-testers/
pms-6,Particulate Matter Sensors,Benefits for Educators & Students (Particulate Matter Sensors),"Brings real-world environmental science into the classroom
Promotes environmental stewardship and student engagement
Prepares students for careers in climate science, public health, and environmental engineering
Enables district-wide air quality tracking for health compliance
Provides administrators and educators with actionable environmental data",https://enviroeducationtools.com/air-quality-atmospheric-testers/
pms-7,Particulate Matter Sensors,Applications for Particulate Matter Sensors,"Middle and high school science curricula
University-level environmental science and engineering programs
Field-based air quality monitoring projects
Campus health and safety initiatives
Research and data analysis competitions
Public health awareness campaigns",https://enviroeducationtools.com/air-quality-atmospheric-testers/
pms-8,Particulate Matter Sensors,Industry Standards (Particulate Matter Sensors),"U.S. Environmental Protection Agency (EPA) Air Quality Index Guidelines
ASHRAE Standard 62.1 – Ventilation for Acceptable Indoor Air Quality
California Air Resources Board (CARB) Sensor Standards
Canadian Ambient Air Quality Standards (CAAQS)",https://enviroeducationtools.com/air-quality-atmospheric-testers/
pms-9,Particulate Matter Sensors,Case Study: Chicago Public High School System...,"Chicago Public High School System (Illinois, USA)
Through a district-wide deployment of our Particulate Matter Sensors, several schools in Chicago implemented hands-on air quality labs. Students collected real-time data, compared indoor vs. outdoor conditions, and presented findings to city officials—enhancing science education and civic engagement simultaneously.

University of Arizona (Tucson, USA)
The university’s Environmental Science department adopted our sensor system in their urban pollution research labs. Students used historical and real-time data to assess seasonal PM trends and created policy reports for city planning committees, strengthening both academic and community ties.
 

Vancouver School District (British Columbia, Canada)
To meet new provincial education standards on climate and health, the district installed Enviro Education Tools’ sensors across six campuses. Real-time dashboards now help educators monitor air quality during wildfires, ensuring student safety and building environmental awareness at a young age.",https://enviroeducationtools.com/air-quality-atmospheric-testers/
ws-1,Weather Stations,Weather Stations (General Description),"Air Quality & Atmospheric Weather Stations Our educational weather stations are all-in-one systems designed to monitor a comprehensive range of atmospheric conditions, including temperature, humidity, wind speed, rainfall, UV index, and barometric pressure. These interactive toolkits are ideal for schools and universities aiming to explore weather dynamics, local climate patterns, and environmental change through real-time data collection and analysis. At Enviro Education Tools, we build these stations with educators in mind—combining rugged, classroom-ready components with guided lesson plans, intuitive interfaces, and built-in data logging features for both short-term experiments and long-term environmental monitoring. Hands-on tools to teach students about climate, weather patterns, and environmental science.

Our Weather Stations are built to enhance environmental literacy and scientific discovery in academic settings. Designed for real-world application and student engagement, our stations deliver real-time data on temperature, humidity, barometric pressure, wind speed, rainfall, and more. Whether you’re outfitting a school science lab or building a district-wide environmental program, our systems provide educators with the tools needed to bring curriculum to life. Headquartered in Philadelphia, PA, we’ve become a trusted name in the education sector across North America, offering innovative, dependable tools backed by expert support. Our Weather Stations help schools integrate environmental science into the classroom through robust, user-friendly technology and scalable solutions.",https://enviroeducationtools.com/air-quality-atmospheric-testers/
ws-2,Weather Stations,Hardware for Weather Stations,"All-in-one sensor suite with solar-powered data transmission
Our Other Environmental Test Instruments are designed to integrate multiple atmospheric sensing technologies into a compact system, ideal for educational demonstrations and research projects.
Wind vane, anemometer, rain gauge, temperature, and humidity sensors
Our Anemometers provide accurate measurements of wind speed and direction for weather monitoring in school projects and lab studies.
Durable and weather-resistant enclosures for long-term outdoor use
Our Temperature Data Loggers ensure reliable and continuous outdoor data collection in varied environmental conditions for long-term educational analysis.

 https://gaotek.com/category/environmental/other-environmental-testers/

https://www.gaotek.com/",https://enviroeducationtools.com/air-quality-atmospheric-testers/
ws-3,Weather Stations,Software and Cloud Services for Weather Stations,"Easy-to-use data visualization dashboards
Customizable data logging intervals and alerts
Downloadable reports for analysis and classroom use Secure, real-time data access via desktop and mobile platforms
Cloud-based data storage with user permissions and history tracking
Integration with educational platforms and online learning systems",https://enviroeducationtools.com/air-quality-atmospheric-testers/
ws-4,Weather Stations,Key Features of Weather Stations,"Real-time atmospheric monitoring (temp, pressure, wind, rainfall, UV)
Solar-powered operation with battery backup
Wireless data transmission (LoRa, Wi-Fi, or cellular options)
Easy installation with educator-friendly setup guides
Alerts and notifications for specific environmental thresholds
Exportable CSV data for classroom experiments and analysis",https://enviroeducationtools.com/air-quality-atmospheric-testers/
ws-5,Weather Stations,Integrations for Weather Stations,"Compatible with educational platforms such as Google Classroom and Microsoft Teams
Can be synced with digital whiteboards and science lab software
Open API for customized app or curriculum development
Compatible with Windows, macOS, ChromeOS, iOS, and Android
Works with most browsers and devices used in K-12 and higher education
Supports integration with weather modeling software and GIS tools",https://enviroeducationtools.com/air-quality-atmospheric-testers/
ws-6,Weather Stations,Benefits for Educators & Students (Weather Stations),"Promotes environmental literacy and scientific engagement
Supports standards-based STEM learning
Enables real-world experiments and data collection
Provides historical and predictive insights for educational projects
Equips schools to monitor local microclimates and air quality",https://enviroeducationtools.com/air-quality-atmospheric-testers/
ws-7,Weather Stations,Applications for Weather Stations,"K-12 science and geography classrooms
University environmental science and meteorology labs
STEM clubs and extracurricular programs
Public libraries and science outreach initiatives
Green school and sustainability programs",https://enviroeducationtools.com/air-quality-atmospheric-testers/
ws-8,Weather Stations,Industry Standards (Weather Stations),"ASTM D1354
NSTA (National Science Teaching Association) Curriculum Standards
NGSS (Next Generation Science Standards)
CSA Group Standards for Educational Equipment",https://enviroeducationtools.com/air-quality-atmospheric-testers/
ws-9,Weather Stations,"Case Study: U.S. – Denver Public Schools,...","U.S. – Denver Public Schools, Colorado
A district-wide initiative equipped 40+ schools with our weather stations to support climate science curriculum. Teachers reported increased student engagement in data-driven learning and saw measurable improvements in science comprehension across middle and high school students.",https://enviroeducationtools.com/air-quality-atmospheric-testers/
ws-10,Weather Stations,Case Study: U.S. – University of Wisconsin–Madison...,"U.S. – University of Wisconsin–Madison
Meteorology students used our advanced weather stations to conduct microclimate research on campus. The data contributed to university-led climate models and allowed undergraduates to publish their findings in student-led journals.",https://enviroeducationtools.com/air-quality-atmospheric-testers/
ws-11,Weather Stations,Case Study: Canada – Toronto District School...,"Canada – Toronto District School Board, Ontario
Enviro Education Tools deployed weather stations at ten high schools as part of an environmental leadership initiative. Data collected supported local sustainability programs and was integrated into community awareness campaigns.",https://enviroeducationtools.com/air-quality-atmospheric-testers/
