chunk_id,main_topic,chunk_title,chunk_text,src_url
tpfw-6,Temperature Probes for Water,Benefits for Educators & Students (Temperature Probes for Water),"Enhanced Learning: Provides students with hands-on experience in environmental science.
Accurate Results: Ensures reliable, reproducible data for educational experiments.
Versatility: Perfect for lab use, outdoor experiments, and field studies.
Time-saving: Streamlined design for quick setup, making it easier to focus on learning outcomes.
Cost-effective: A long-lasting solution that reduces the need for frequent replacements",https://enviroeducationtools.com/water-quality-and-hydrology-testers/
tpfw-7,Temperature Probes for Water,Applications for Temperature Probes for Water,"Environmental Science Education: Enables students to study water temperature in ecosystems and aquatic environments.
Water Quality Monitoring: Measures the impact of temperature changes on water quality.
Field Studies: Perfect for field-based learning, providing accurate readings in remote locations.
Lab-based Learning: Ideal for conducting controlled experiments in classroom settings.",https://enviroeducationtools.com/water-quality-and-hydrology-testers/
tpfw-8,Temperature Probes for Water,Industry Standards (Temperature Probes for Water),"ASTM D1125 – Standard Test Methods for Electrical Conductivity and Resistivity of Water
ISO 7346 – Water Quality – Determination of Temperature
Environment Canada’s Water Quality Guidelines",https://enviroeducationtools.com/water-quality-and-hydrology-testers/
tpfw-9,Temperature Probes for Water,"Case Study: A high school, science program...","A high school, science program in California incorporated our Temperature Probes for Water into their environmental science curriculum. By measuring the impact of seasonal changes on local freshwater bodies, students gained a deeper understanding of how temperature affects aquatic life.


In a university in Oregon, researchers used our probes for a study on the effects of water temperature on fish migration patterns in river systems. The probes provided real-time, accurate data critical to the study’s success, helping students and faculty contribute to impactful environmental research.


A Canadian environmental institute, used our probes in a freshwater ecosystem study along the Ontario shoreline. The probes were integrated into field research, helping students collect essential data for their thesis on the effects of water temperature on local biodiversity.",https://enviroeducationtools.com/water-quality-and-hydrology-testers/
smm-1,Soil Moisture Meters,Soil Moisture Meters (General Description),"Soil and Environmental Health Soil Moisture Meters Our soil moisture meters offer a vital gateway into understanding hydrological cycles and plant-soil interactions. Designed with educational needs in mind, these meters allow students to analyze water content in various types of soil with high precision. Whether conducting experiments in school gardens or controlled lab environments, learners gain hands-on experience in evaluating irrigation practices, drought conditions, and soil permeability. Enviro Education Tools provides devices that are portable, durable, and easy to interpret, fostering a stronger connection between theory and real-world application. Hands-on tools that help students and researchers explore soil health, agriculture, and environmental science.

We specialize in equipping educators and students with advanced tools to understand environmental systems through hands-on experience. Our Soil Moisture Meters are designed specifically for educational use—combining precision measurement, intuitive interfaces, and long-term durability. These devices provide real-time data on water content in soil, helping users study irrigation practices, drought conditions, and the hydrological cycle. Ideal for classrooms, labs, field trips, and agricultural programs, our meters empower learners to explore the science behind soil health and environmental sustainability. Headquartered in Philadelphia, PA, we proudly serve schools and institutions across North America, offering the tools and support needed for meaningful environmental education.",https://enviroeducationtools.com/soil-and-environmental-health-testers/
smm-2,Soil Moisture Meters,Hardware for Soil Moisture Meters,"Durable sensor probes with high accuracy and corrosion resistance: Our Soil Moisture Meters feature high-precision probes for consistent and reliable readings in educational settings, ideal for environmental science experiments.
Digital displays or wireless-enabled handheld units: Sound Level Meters provide clear digital displays to monitor noise levels in classrooms and outdoor environments, enhancing studies on environmental health.
Rechargeable battery systems with field-grade portability: The Temperature Data Loggers offer long-lasting battery life for monitoring temperature variations in different educational projects, ensuring portability and ease of use for field research. https://www.gaotek.com/soil-moisture-meters 

https://www.gaotek.com/sound-level-meters 

https://www.gaotek.com/temperature-data-loggers",https://enviroeducationtools.com/soil-and-environmental-health-testers/
smm-3,Soil Moisture Meters,Software and Cloud Services for Soil Moisture Meters,"User-friendly mobile apps for live tracking and data analysis
Windows/macOS desktop platforms for exporting long-term data sets
Calibration tools for in-field accuracy adjustments Optional cloud data logging and visualization platforms
Secure multi-user dashboard access for educational groups
Long-term data storage with exportable CSV support",https://enviroeducationtools.com/soil-and-environmental-health-testers/
smm-4,Soil Moisture Meters,Key Features of Soil Moisture Meters,"Real-time soil moisture measurement in percentage or volumetric units
Depth-specific readings for layered soil analysis
On-device and remote display capabilities
Field-to-cloud connectivity for remote monitoring
Auto-calibration and temperature compensation
Battery indicators and data logging support",https://enviroeducationtools.com/soil-and-environmental-health-testers/
smm-5,Soil Moisture Meters,Integrations for Soil Moisture Meters,"Compatible with most environmental monitoring systems used in classrooms
Seamlessly integrates with Enviro Education Tools’ full suite of environmental testers
Optional API for integration into third-party educational dashboards",https://enviroeducationtools.com/soil-and-environmental-health-testers/
smm-6,Soil Moisture Meters,Benefits for Educators & Students (Soil Moisture Meters),"Enhances student understanding of water cycles and soil health
Supports STEM and agricultural science programs
Provides reliable data for real-world environmental experiments
Encourages outdoor learning with field-ready equipment
Helps meet sustainability and conservation education goals",https://enviroeducationtools.com/soil-and-environmental-health-testers/
smm-7,Soil Moisture Meters,Applications for Soil Moisture Meters,"School and university science labs
Agricultural and horticultural programs
Environmental science fieldwork
Urban gardening and soil restoration initiatives
Hydrological research and modeling activities",https://enviroeducationtools.com/soil-and-environmental-health-testers/
smm-8,Soil Moisture Meters,Industry Standards (Soil Moisture Meters),"ASTM D2216
NRCS Soil Survey Manual
EPA Water Quality Monitoring Standards
ANSI/ASAED 62310
Canadian Standards Association (CSA) – Soil and Water Monitoring",https://enviroeducationtools.com/soil-and-environmental-health-testers/
smm-9,Soil Moisture Meters,Case Study: United States – California Urban...,"United States – California Urban School District
A STEM-focused middle school in San Diego integrated our soil moisture meters into their sustainability curriculum. Students used the devices to analyze soil health in their school garden, leading to optimized irrigation schedules and a 25% reduction in water usage.

United States – Midwest University Agricultural Program
A state university in Illinois deployed Enviro Education Tools’ soil moisture meters in their undergraduate agronomy courses. The project enabled real-time tracking of soil conditions across test plots, helping students apply data analytics to soil-water management strategies.",https://enviroeducationtools.com/soil-and-environmental-health-testers/
smm-10,Soil Moisture Meters,Case Study: Canada – British Columbia High...,"Canada – British Columbia High School Ecology Program
A high school in Vancouver introduced soil moisture meters as part of an outdoor ecology project. Students measured water retention across different soil types, contributing data to a local watershed conservation initiative and increasing environmental engagement among youth.",https://enviroeducationtools.com/soil-and-environmental-health-testers/
spt-1,Soil pH Testers,Soil pH Testers (General Description),"Soil and Environmental Health Soil pH Testers Understanding soil acidity or alkalinity is key to exploring chemical and biological soil properties. Our pH testers are calibrated for educational environments, enabling students to perform accurate readings and interpret results within minutes. Used widely in agronomy and hydrology studies, these testers empower educators to teach how water movement affects nutrient availability and microbial activity. With our commitment to product reliability, Enviro Education Tools ensures these instruments are ideal for repeated classroom use and outdoor experiments alike. Accurate tools to measure soil acidity and alkalinity, supporting hands-on environmental science learning.

Soil pH plays a critical role in understanding soil chemistry, nutrient availability, and plant growth. We provide highly accurate, durable, and easy-to-use Soil pH Testers tailored specifically for educational settings. Designed for both indoor lab environments and outdoor fieldwork, our testers bridge the gap between theoretical knowledge and real-world data collection. With quick-read capabilities, digital and analog interfaces, and compatibility with educational platforms, these testers allow students and instructors to investigate soil properties with professional-grade accuracy. Headquartered in Philadelphia, PA, Enviro Education Tools leads the way in delivering smart, scalable environmental testing solutions to classrooms, universities, and research institutes across North America.",https://enviroeducationtools.com/soil-and-environmental-health-testers/
spt-2,Soil pH Testers,Hardware for Soil pH Testers,"Durable, waterproof digital soil pH testers: Our Colorimeters are essential for educational environments where accurate chemical analysis of water or soil samples is required, ensuring precise readings for environmental health studies.
Replaceable probe sensors with high-sensitivity electrodes: The Radiation Meters offer high-sensitivity detection for measuring environmental radiation levels, making them ideal for classroom experiments and educational purposes.
Handheld, battery-operated designs with rugged casing: Our Anemometers are designed with portability in mind, perfect for fieldwork or in-class experiments to measure wind speed and airflow in environmental science lessons.
Built-in calibration functionality with standard buffer solutions: The Moisture Analyzers & Meters come with calibration features to ensure consistent moisture measurement in soil, making them highly useful for educational testing in agricultural or environmental studies. https://www.gaotek.com/colorimeters 

https://www.gaotek.com/radiation-meters  

https://www.gaotek.com/anemometers 

https://www.gaotek.com/moisture-analyzers-meters",https://enviroeducationtools.com/soil-and-environmental-health-testers/
spt-3,Soil pH Testers,Software and Cloud Services for Soil pH Testers,"User-friendly interface for data display and logging
pH tracking apps for field use (Android/iOS compatible)
Real-time digital calibration alerts Optional cloud integration for data backup and sharing
CSV export features for educational documentation
Secure educator portal for class-based experiment tracking",https://enviroeducationtools.com/soil-and-environmental-health-testers/
spt-4,Soil pH Testers,Key Features of Soil pH Testers,"Fast and accurate pH readings from 0 to 14
Auto temperature compensation for consistent data
Dual calibration support (manual and auto)
Digital LCD backlit display for clear visibility
Replaceable sensor heads for long-term usability
Lightweight, portable design ideal for classrooms and field trips
Long battery life and auto-off function for energy efficiency",https://enviroeducationtools.com/soil-and-environmental-health-testers/
spt-5,Soil pH Testers,Integrations for Soil pH Testers,"Compatible with standard LMS platforms like Google Classroom and Moodle
CSV-compatible with Excel, Google Sheets, and most data visualization software
Syncs with mobile apps for live readings during science projects

Works with soil types across agricultural, forest, wetland, and urban environments
Supports use with both Mac and Windows data platforms
Compatible with mobile devices (Bluetooth-enabled models available)",https://enviroeducationtools.com/soil-and-environmental-health-testers/
spt-6,Soil pH Testers,Benefits for Educators & Students (Soil pH Testers),"Encourages real-world STEM learning through direct environmental engagement
Promotes understanding of noise pollution and its social impact
Ideal for both indoor lab work and outdoor field studies
Helps schools comply with environmental curriculum requirements
Reinforces principles of environmental physics, public health, and sustainability",https://enviroeducationtools.com/soil-and-environmental-health-testers/
spt-7,Soil pH Testers,Applications for Soil pH Testers,"Environmental science labs and coursework
Agricultural research and soil management studies
Classroom demonstrations of chemical properties
Outdoor experiments in school gardens and conservation areas
Citizen science projects and eco-literacy initiatives",https://enviroeducationtools.com/soil-and-environmental-health-testers/
spt-8,Soil pH Testers,Industry Standards (Soil pH Testers),"EPA Soil Quality Guidelines
ASTM D4972 – Standard Test Method for pH of Soils
NRCS Soil Testing Recommendations (USDA)
Canadian Council of Ministers of the Environment (CCME) Soil Standards",https://enviroeducationtools.com/soil-and-environmental-health-testers/
spt-9,Soil pH Testers,Case Study: United States – Pennsylvania High...,"United States – Pennsylvania High School STEM Program
A public high school in Pittsburgh integrated our soil pH testers into its 10th-grade environmental science curriculum. By incorporating field experiments into the syllabus, student engagement increased by 40%, and final project scores improved due to a stronger understanding of pH in urban soils.

United States – California Community College
A college in Northern California adopted our digital soil pH testers for its agriculture tech course. Professors cited a 25% time-saving in lab setup and student groups successfully mapped soil pH variations across the campus farm, enhancing hands-on learning experiences.",https://enviroeducationtools.com/soil-and-environmental-health-testers/
spt-10,Soil pH Testers,Case Study: Canada – Ontario Agricultural Institute...,"Canada – Ontario Agricultural Institute
An Ontario-based post-secondary agricultural institute deployed our soil pH testers across its sustainable farming programs. The integration allowed students to create real-time soil maps and perform comparative studies with historical data, improving both research quality and student confidence in fieldwork.",https://enviroeducationtools.com/soil-and-environmental-health-testers/
lm/lm-1,Light Meters / Lux Meters,Light Meters / Lux Meters (General Description),"Soil and Environmental Health Light Meters / Lux Meters Light plays a crucial role in water evaporation, plant growth, and ecosystem balance. Our lux meters are used in educational programs to assess light intensity across various environments, helping students connect sunlight exposure with soil drying rates, water retention, and vegetation patterns. Featuring user-friendly interfaces and high sensitivity, these meters are built to enhance curriculum-based activities. Enviro Education Tools integrates these tools seamlessly into environmental science labs to support deeper ecological understanding. Accurate instruments designed to measure light intensity for classrooms, labs, and fieldwork.

We understand the critical role that light intensity plays in environmental monitoring, plant biology, and atmospheric studies. Our Light Meters / Lux Meters are purpose-built for educational and research institutions that seek accurate, real-time lux data in both indoor and outdoor environments. From classroom experiments to long-term field studies, our instruments provide a seamless, reliable user experience. Designed with educators, researchers, and students in mind, our meters are robust, easy to operate, and deliver consistently precise readings. Headquartered in Philadelphia, PA, Enviro Education Tools has become a trusted provider of innovative testing equipment for the education sector. Our light meters reflect our core values: precision, reliability, and accessibility. Supported by ongoing product development and strict quality assurance, these systems deliver the data you need to teach, learn, and discover with confidence.",https://enviroeducationtools.com/soil-and-environmental-health-testers/
lm/lm-2,Light Meters / Lux Meters,Hardware for Light Meters / Lux Meters,"Handheld and mountable light sensors with digital display: Our Infrared Thermometers & Cameras provide accurate temperature readings, essential for educational experiments involving heat and thermal imaging in environmental studies.
Weather-resistant casing for field use: The Hygrometers are designed with rugged, weather-resistant casings to measure humidity in various environmental conditions, ideal for outdoor educational activities and experiments.
USB or Bluetooth-enabled data transfer modules: Our Turbidimeters use Bluetooth data transfer, making it easy for students to record and analyze water quality data in real-time during fieldwork, offering hands-on learning experiences in environmental science. https://www.gaotek.com/infrared-thermometers-cameras 

https://www.gaotek.com/hygrometers 

https://www.gaotek.com/turbidimeters",https://enviroeducationtools.com/soil-and-environmental-health-testers/
lm/lm-3,Light Meters / Lux Meters,Software and Cloud Services for Light Meters / Lux Meters,"Custom data logging application (Windows/macOS compatible)
Real-time graphical visualization and export features
Adjustable sample rates and calibration tools Secure cloud-based data storage
Historical data comparison dashboards
Role-based access for educational groups",https://enviroeducationtools.com/soil-and-environmental-health-testers/
lm/lm-4,Light Meters / Lux Meters,Key Features of Light Meters / Lux Meters,"Real-time lux and foot-candle measurement
Wide dynamic range (0–200,000 lux) for indoor and outdoor use
Auto/manual ranging modes
Data logging with timestamped recordings
Calibration option for various light sources (LED, fluorescent, natural sunlight)
Large backlit display for low-light reading environments
Rechargeable or replaceable battery options",https://enviroeducationtools.com/soil-and-environmental-health-testers/
lm/lm-5,Light Meters / Lux Meters,Integrations for Light Meters / Lux Meters,"Compatible with common environmental data systems
Seamless connection to classroom smart boards or lab computers
Integration-ready APIs for advanced research setups
Support for CSV export for use in Microsoft Excel, MATLAB, and Google Sheets",https://enviroeducationtools.com/soil-and-environmental-health-testers/
lm/lm-6,Light Meters / Lux Meters,Benefits for Educators & Students (Light Meters / Lux Meters),"Empowers educators to integrate real-world environmental data into curriculum
Helps students understand photosynthesis, energy efficiency, and light pollution
Facilitates fieldwork and remote monitoring in diverse environments
Enhances STEM learning through sensor-based experimentation
Promotes sustainability awareness and measurement-driven science projects",https://enviroeducationtools.com/soil-and-environmental-health-testers/
lm/lm-7,Light Meters / Lux Meters,Applications for Light Meters / Lux Meters,"Environmental science classes and lab programs
Agricultural and horticultural studies
Architectural daylight planning and efficiency assessments
Greenhouse and controlled-environment agriculture research
Smart classroom experiments involving IoT and sensor networks",https://enviroeducationtools.com/soil-and-environmental-health-testers/
lm/lm-8,Light Meters / Lux Meters,Industry Standards (Light Meters / Lux Meters),"ANSI C136.10
NIST Traceable Calibration Standards
EPA Guidelines for Environmental Education
ASTM E284
CSA Group Standard C861",https://enviroeducationtools.com/soil-and-environmental-health-testers/
lm/lm-9,Light Meters / Lux Meters,"Case Study: Jefferson High School, Oregon Jefferson...","Jefferson High School, Oregon
Jefferson High’s AP Environmental Science program used Enviro Education Tools’ light meters to compare light intensity in various classroom window orientations. Students successfully designed an energy-efficient layout for plant growth using real-time data, resulting in a local award for sustainable education practices.

University of Illinois at Urbana-Champaign
Graduate students used our lux meters in a semester-long greenhouse energy optimization project. The system helped them identify underlit zones and adjust lighting schedules to reduce energy consumption by 18%, using data visualized through our desktop software.

Toronto District School Board – Environmental Learning Centre
In partnership with the school board, our light meters were deployed in outdoor classrooms to help elementary students study plant-light relationships. Teachers integrated sensor data into inquiry-based lessons, increasing engagement and comprehension in ecological units.",https://enviroeducationtools.com/soil-and-environmental-health-testers/
slm-1,Sound Level Meters,Sound Level Meters (General Description),"Soil and Environmental Health Sound Level Meters Though not traditionally associated with hydrology, sound meters are increasingly used to study environmental impact in water-rich areas, such as analyzing noise pollution near wetlands, rivers, and stormwater systems. Our sound level meters give learners the ability to measure decibel levels with confidence, enabling them to assess how human activity interacts with aquatic environments. These educational-grade tools offered by Enviro Education Tools are vital in cross-disciplinary studies involving environmental planning and public health. Helping students understand the impact of sound on health, ecosystems, and urban environments 

Our Sound Level Meters are engineered to empower educators, students, and researchers with reliable tools for measuring environmental noise. Whether studying urban noise pollution, analyzing decibel levels in natural environments, or conducting STEM-based field experiments, our meters offer precision, portability, and ease of use. Tailored specifically for educational institutions, our devices combine professional-grade accuracy with classroom-friendly operation. Headquartered in Philadelphia, PA, Enviro Education Tools serves schools and universities across North America with an unwavering focus on innovation, product durability, and customer support. We help educators bring environmental science to life, offering smart, scalable solutions that meet modern teaching needs and compliance standards.",https://enviroeducationtools.com/soil-and-environmental-health-testers/
slm-2,Sound Level Meters,Hardware for Sound Level Meters,"Compact, handheld digital sound level meters: Our Sound Level Meters & Calibrators offer precise noise level measurements, perfect for classroom experiments and outdoor educational activities on environmental noise pollution.
High-sensitivity microphones with windscreen options: The Radiation Meters feature high-sensitivity detection, ensuring accurate measurements in the field for educational research on environmental radiation levels.
LCD/LED backlit display for outdoor or dim-light use: Our Temperature Data Loggers provide clear, backlit displays to monitor temperature in challenging lighting conditions, making them ideal for fieldwork in environmental education.
Battery-powered with USB rechargeable options: The Gas Analyzers are battery-powered with USB rechargeability, ideal for educational environments requiring portable, long-lasting tools for monitoring air quality and gas concentrations. https://www.gaotek.com/sound-level-meters-calibrators 

https://www.gaotek.com/radiation-meters 

https://www.gaotek.com/temperature-data-loggers

https://www.gaotek.com/gas-analyzers",https://enviroeducationtools.com/soil-and-environmental-health-testers/
slm-3,Sound Level Meters,Software and Cloud Services for Sound Level Meters,"PC connectivity for data download and analysis
Real-time decibel monitoring applications
Custom calibration settings for classroom experiments Cloud-based data logging and analysis
User-friendly dashboards for tracking long-term noise exposure
Secure file storage for reports and student submissions",https://enviroeducationtools.com/soil-and-environmental-health-testers/
