chunk_id,main_topic,chunk_title,chunk_text,src_url
aqt-overview,Air Quality Testers,Air Quality Testers (General Overview),"Air quality testers play a vital role in monitoring and maintaining healthy indoor environments, a function that is especially critical within sensitive, high-occupancy locations such as science laboratories and classrooms. Our systems are specifically engineered to serve a dual purpose: ensuring robust compliance with occupational health and safety standards while simultaneously enhancing air-related education topics.
 
In a typical classroom setting, a primary challenge is the consistent buildup of carbon dioxide ($CO_2$) resulting from student respiration in an enclosed space. Elevated $CO_2$ levels are directly correlated with decreased cognitive function, drowsiness, and a significant drop in student concentration. Our testers continuously monitor $CO_2$ and other parameters like humidity and temperature, providing real-time data that can trigger ventilation systems or simply alert educators to the need for fresh air, thereby optimizing the learning environment.
 
Science laboratories introduce a more complex set of risks. The regular use of chemical reagents, solvents, heating processes, or biological samples can release a wide range of contaminants, including Volatile Organic Compounds (VOCs) and fine particulate matter (PM2.5). Chronic exposure to these airborne substances can pose serious long-term health implications for both students and staff. Our systems provide immediate, granular data on these specific pollutants, allowing for instant mitigation measures—such as activating fume hoods—and generating essential data logs required for health compliance audits.
 
Beyond mere compliance, these testers function as powerful educational tools. The live data gathered—such as $CO_2$ fluctuations throughout the school day, PM2.5 spikes during a chemistry experiment, or VOC levels during a biology dissection—can be exported and analyzed by students. This integration transforms abstract concepts in environmental science, chemistry, and biology into tangible, actionable data. Instructors can design lessons where students graph their own classroom's air quality, correlate pollutants with specific activities, and propose data-driven solutions. This provides a practical, hands-on application of STEM methodology, teaching data analysis, environmental stewardship, and public health awareness simultaneously.",https://enviroeducationtools.com/
wqt-overview,Water Quality Testers,Water Quality Testers (General Overview),"Water quality testers are fundamental tools for both laboratory safety and immersive, field-based education. Our suite of sensors—including precision pH meters, advanced turbidity sensors, and reliable dissolved oxygen meters—is essential for ensuring safety during water-based experiments and remote outdoor sampling activities. More than just safety devices, they are powerful instruments for teaching core principles of analytical chemistry and environmental hydrology.

In a laboratory setting, safety and precision are paramount. For instance, chemistry students conducting titration or neutralization experiments can use our pH meters to track acidity and alkalinity in real-time, ensuring their experiment is accurate and that waste products are safe for disposal. In biology, monitoring the dissolved oxygen ($DO$) and pH levels in an aquatic habitat (like a classroom aquarium) is critical for maintaining the health of its organisms, demonstrating a direct, life-or-death link between water chemistry and biological systems.

The true power of these tools is realized during outdoor sampling activities. When students conduct field studies on a local pond, river, or stream, these portable testers provide immediate, actionable data on the ecosystem's health:

pH Meters: A sudden drop or spike in pH can be a direct indicator of chemical pollution (like industrial discharge) or the environmental stress caused by acid rain.
Turbidity Sensors: These measure water clarity (or cloudiness). High turbidity, often caused by soil erosion from construction sites or agricultural runoff, blocks sunlight, which prevents aquatic plants from photosynthesizing and can suffocate fish by clogging their gills.
Dissolved Oxygen ($DO$) Meters: This is one of the most critical indicators of a water body's health. Low $DO$ levels (hypoxia) are often a sign of eutrophication. This occurs when fertilizer runoff causes massive algae blooms; when the algae die and decompose, bacteria consume all the available oxygen, creating a ""dead zone"" that is lethal to fish and other aquatic organisms.

This hands-on data collection transforms abstract environmental science concepts into a tangible, high-impact learning experience. Instead of just reading about ""eutrophication"" in a textbook, students can measure its direct effects. They learn to collect, graph, and analyze real-world data, test hypotheses about pollution sources (e.g., ""the turbidity is higher after it rains""), and propose data-driven solutions for their local watershed. This directly supports STEM curriculum by fostering deep skills in data analysis, critical thinking, and environmental stewardship.",https://enviroeducationtools.com/
sqt-overview,Soil Quality Testers,Soil Quality Testers (General Overview),"Air quality testers play a vital role in monitoring and maintaining healthy indoor environments, a function that is especially critical within sensitive, high-occupancy locations such as science laboratories and classrooms. Our systems are specifically engineered to serve a dual purpose: ensuring robust compliance with occupational health and safety standards while simultaneously enhancing air-related education topics.

In a typical classroom setting, a primary challenge is the consistent buildup of carbon dioxide ($CO_2$) resulting from student respiration in an enclosed space. Elevated $CO_2$ levels are directly correlated with decreased cognitive function, drowsiness, and a significant drop in student concentration. Our testers continuously monitor $CO_2$ and other parameters like humidity and temperature, providing real-time data that can trigger ventilation systems or simply alert educators to the need for fresh air, thereby optimizing the learning environment.

Science laboratories introduce a more complex set of risks. The regular use of chemical reagents, solvents, heating processes, or biological samples can release a wide range of contaminants, including Volatile Organic Compounds (VOCs) and fine particulate matter (PM2.5). Chronic exposure to these airborne substances can pose serious long-term health implications for both students and staff. Our systems provide immediate, granular data on these specific pollutants, allowing for instant mitigation measures—such as activating fume hoods—and generating essential data logs required for health compliance audits.

Beyond mere compliance, these testers function as powerful educational tools. The live data gathered—such as $CO_2$ fluctuations throughout the school day, PM2.5 spikes during a chemistry experiment, or VOC levels during a biology dissection—can be exported and analyzed by students. This integration transforms abstract concepts in environmental science, chemistry, and biology into tangible, actionable data. Instructors can design lessons where students graph their own classroom's air quality, correlate pollutants with specific activities, and propose data-driven solutions. This provides a practical, hands-on application of STEM methodology, teaching data analysis, environmental stewardship, and public health awareness simultaneously.",https://enviroeducationtools.com/
efs-overview,Educational Field Studies,Educational Field Studies (General Overview),"Field-based education becomes exponentially more powerful when paired with reliable environmental data. The traditional field study, while valuable for observation, often stops at a qualitative assessment. Our portable, durable environmental testers bridge this critical gap, transforming passive observation into active, quantitative scientific inquiry. Our systems support real-time measurements of air, water, and soil conditions directly in natural settings.

This capability allows educators to move lessons from the abstract textbook to the tangible world. Instead of simply discussing the concept of water pollution, students can stand by a local river and capture immediate, quantifiable data on parameters like pH, dissolved oxygen (DO), turbidity, and nitrate levels. They can test a hypothesis on the spot, for example, by comparing water quality upstream and downstream from a suspected discharge point.

Similarly, soil science becomes dynamic. Students can measure soil moisture, pH, and NPK (Nitrogen, Phosphorus, Potassium) content across different micro-ecosystems—such as a dense forest floor versus an open meadow—to understand firsthand why different plant communities thrive in each location. For air quality, portable monitors can map particulate matter (PM2.5) or $CO_2$ levels near a busy roadway compared to a protected park, making invisible pollutants visible and understandable.

The ""portable"" and ""durable"" design features are non-negotiable for this context. Portability ensures devices can be easily carried in backpacks on hikes to remote locations. Durability—often including weather-resistant or shock-proof construction—is essential to withstand the rigors of field use by students, ensuring reliable data collection regardless of mud, rain, or accidental drops. By providing instant, geo-tagged data, these testers enable students to build robust datasets for later analysis, completing the scientific learning loop from field hypothesis to classroom conclusion.",https://enviroeducationtools.com/
slac-overview,Science Labs and Campuses,Science Labs and Campuses (General Overview),"In science labs and campus facilities, environmental testers offer the technological backbone for both evidence-based experimentation and comprehensive facility safety. Their role extends far beyond simple data logging; they are active instruments that ensure precision and compliance. Our tools allow educators, researchers, and facility managers to measure temperature, humidity, radiation, sound levels, and other critical environmental parameters with verifiable precision.

For evidence-based experimentation, data validity hinges on the control of environmental variables. Our testers provide this control. In a biology lab, a cell culture experiment can be rendered invalid by minor, unrecorded fluctuations in temperature or humidity. In a materials science lab, the properties of a polymer being tested can change drastically with ambient conditions. Our sensors provide high-precision, real-time monitoring and data logging, giving researchers the verifiable proof needed to confirm that their experimental conditions were stable and that their results are reproducible.

In the context of facility safety, these tools are indispensable. In physics departments or medical research facilities utilizing radioisotopes, our radiation monitors are essential for ensuring that exposure levels remain well within mandated safety limits, protecting both students and staff. Similarly, in engineering workshops, campus power plants, or machine labs, our sound level meters are used to map high-noise zones. This data is critical for enforcing hearing protection protocols and ensuring compliance with occupational health and safety (OSHA) standards.

This utility extends across the entire campus. Critical infrastructure, such as server rooms and data centers, relies on our temperature and humidity monitors to prevent catastrophic equipment failure from overheating. Likewise, library archives and campus museums use these same sensors to protect priceless collections and historical artifacts from degradation, mold, or brittleness. By providing precise, actionable data, these environmental testers empower facility managers to move from reactive fixes to proactive, predictive maintenance.",https://enviroeducationtools.com/
ei-overview,Educational Institutions,Educational Institutions (General Overview),"Environmental testers play a vital role in creating safe, data-informed, and interactive learning environments across K-12 schools, colleges, and universities. This technology bridges the gap between theoretical curriculum and practical, real-world application. From monitoring indoor air quality in a kindergarten classroom to analyzing soil composition for a university agricultural study and ensuring water safety in campus dormitories, our tools help educators build practical skills in real-time environmental assessment.

For K-12 institutions, the primary focus is often on fundamental health and safety. Our monitors can track indoor air quality (IAQ) parameters like $CO_2$, which directly impacts student concentration, and PM2.5, a known asthma trigger. This data empowers facility managers to optimize ventilation, creating a healthier learning space. In the classroom, simple-to-use soil testers can turn a school garden into a living biology lab, while water quality kits allow young students to test pond or stream water, introducing them to ecological concepts.

At the college and university level, these applications scale in complexity and scope. In research laboratories, our testers are essential for ensuring safety compliance by monitoring for VOCs, chemical fumes, or specific gases. For environmental science departments, portable field kits allow students to conduct comprehensive, publishable research—measuring dissolved oxygen in local waterways, mapping heavy metal contamination in soil, or tracking micro-climates across campus.

This creates a ""data-informed"" campus. Facility-wide, this data is no longer just for experiments; it informs operational decisions. HVAC systems can be managed more efficiently based on real-time occupancy and air quality data, saving energy while improving health. The data provides a verifiable record of compliance with health standards, protecting the institution and its community. Ultimately, these testers transform the entire campus into an interactive learning environment where students don't just learn about science—they participate in it.",https://enviroeducationtools.com/
tewsetd-overview,Transforming Education with Strategic Environmental Testing Deployment,Transforming Education with Strategic Environmental Testing Deployment (General Overview),"Strategic deployment of environmental testers is fundamentally reshaping how institutions deliver scientific education. It marks a shift from simply owning devices to implementing an integrated, data-driven methodology. By converting raw, real-time environmental data into meaningful learning outcomes, schools and universities can profoundly enhance curriculum delivery, enforce dynamic lab safety, and promote genuine critical inquiry.

This ""strategic"" element is key. It means placing $CO_2$ and PM2.5 sensors in high-traffic lecture halls to optimize air quality for cognitive function, while simultaneously deploying highly specific VOC (Volatile Organic Compound) sensors in chemistry labs. It involves equipping field study teams with networked, GPS-enabled water testers, not just isolated devices.

This approach allows data to become a ""meaningful learning outcome."" Instead of just reading a textbook chapter on pollution, students can actively track dissolved oxygen levels in a local river before and after a storm event, analyzing the real-world impact of runoff. This process promotes critical inquiry by tasking students with interpreting fluctuations, correlating data with events, and presenting evidence-based conclusions.

The ability to act on sensor-based feedback allows educators and staff to make informed decisions. In a lab setting, this feedback loop is a critical safety feature. A sensor detecting solvent fumes above a pre-set threshold can automatically trigger an emergency ventilation system or send an instant alert, moving safety protocols from reactive to proactive. This same data supports academic rigor by ensuring experimental variables are controlled.

Furthermore, this strategy links academic goals with operational efficiency. The same $CO_2$ data that informs an educator about student drowsiness can be used by facility managers to optimize HVAC cycles, reducing energy costs by ventilating rooms only when they are occupied and air quality dictates. This intelligent deployment supports a healthier, more sustainable, and more effective learning environment.",https://enviroeducationtools.com/
bfee-overview,Built for Education Excellence,Built for Education Excellence (General Overview),"Our platforms are engineered from the ground up to meet the specific demands of learning and research, offering a synthesis of educational-grade accuracy, robust analytics, and scalable deployment. This unique combination ensures we can support the entire academic spectrum—from a single, small science lab in a K-12 school to large, interconnected university research centers.

""Educational-grade accuracy"" means our sensors provide data that is reliable, repeatable, and precise enough for genuine scientific inquiry. Unlike consumer-grade gadgets, which may only show general trends, our instruments are calibrated to deliver measurements that can be trusted for experiments, published in papers, and used to validate a hypothesis. This is critical for teaching correct scientific methodology, where data integrity is the foundation of any conclusion.

This accurate data feeds into our ""robust analytics"" platform. We provide more than just a live number on a screen. Our systems feature automated data logging, customizable dashboards for visualizing real-time and historical trends, and powerful export functions. Students and researchers can easily pull raw data (e.g., as a CSV file) for deep analysis in tools like Excel, Python, or R, enabling them to write detailed reports, identify long-term patterns, and correlate environmental factors with their experimental outcomes.

Finally, ""scalable deployment"" addresses the diverse needs and budgets of educational institutions. A single school can start with one standalone device for a specific classroom project. As needs grow, the platform scales. A university department can deploy dozens of sensors across its teaching labs, all feeding into a central dashboard for the lab manager and safety officer. At the highest level, an entire university can implement a campus-wide, networked system of hundreds of sensors, integrating environmental data on air, water, and lab conditions directly into its building management and research infrastructure. This scalability ensures that whether you are equipping a small lab or a major research center, you are investing in a platform that can grow with you.",https://enviroeducationtools.com/
feti-overview,Full Environmental Testing Integration,Full Environmental Testing Integration (General Overview),"We deliver a comprehensive, end-to-end solution that goes far beyond simply providing a sensor. Our integrated ecosystem combines durable hardware, seamless wireless connectivity, intuitive cloud-based dashboards, and powerful analysis software. This ""full stack"" approach eliminates the common integration challenges, compatibility issues, and data silos that institutions often face when trying to piece together a monitoring system from multiple vendors.

It begins with our durable hardware. Designed specifically for the rigors of educational and field environments, our testers feature robust, impact-resistant casings for lab use and are often weather-sealed (IP-rated) for outdoor field studies. This ensures a long operational life and a lower total cost of ownership, as the devices can withstand accidental drops, chemical splashes, or exposure to the elements.

This hardware is enhanced with wireless connectivity. Instead of relying on manual data logging or cumbersome USB transfers, our devices use technologies like Wi-Fi, Bluetooth, or LoRaWAN to transmit data automatically and in real-time. This frees educators and researchers from the task of data transcription, reduces human error, and allows for remote monitoring. A lab manager can check the status of multiple rooms from a single office, or a teacher can project live data from a field sensor back to the classroom.

All data streams converge on our cloud-based dashboards. This centralized, web-accessible hub is the command center for the entire system. From any computer or mobile device, users can view live readings, check device status, and configure automated alerts (e.g., ""Send an email if Lab 3's temperature exceeds 30°C""). This provides instant situational awareness and allows for proactive safety or maintenance responses.

Finally, the data is made meaningful through our analysis software. The platform automatically logs all historical data, enabling powerful trend analysis. Students can graph air quality changes over a full semester, correlate water quality with weather events, or export clean datasets (as CSV or Excel files) for use in their research papers. This complete, frictionless integration—from data capture to final analysis—allows educators to focus on teaching, not on troubleshooting technology.",https://enviroeducationtools.com/
gr-overview,Geographic Reach,Geographic Reach (General Overview),"We proudly support educational and research institutions across the United States and Canada. This dedicated geographic focus is a strategic choice, not a limitation. It allows us to provide a deeply specialized and responsive service tailored to the specific regulatory, logistical, and educational needs of North American institutions.

Our commitment begins with quick deployment. We maintain logistics and distribution hubs within both the U.S. and Canada. This domestic presence ensures that when you order our environmental testers, you are not faced with unpredictable international shipping delays, import tariffs, or complex customs brokerage. Your hardware arrives quickly and efficiently, allowing you to integrate it into your curriculum or facility management plan without frustrating delays.

This regional focus is also a core part of our training and after-sales service. Our expert support teams are based in North America, operating in your time zones. When you need technical assistance, you are connecting with a specialist who understands your context. We provide a full suite of support, from initial setup and software training via webinars to troubleshooting and hardware diagnostics.

Crucially, all after-sales service—including calibration, warranty claims, and repairs—is handled domestically. This eliminates the massive cost and extended downtime associated with shipping critical equipment internationally for service. Our goal is to ensure your devices have maximum uptime, keeping your labs operational and your field studies on schedule. This localized support structure guarantees a seamless experience, from initial purchase to long-term maintenance, for all your environmental testing needs.",https://enviroeducationtools.com/
peap-overview,Premium Equipment and Partnerships,Premium Equipment and Partnerships (General Overview),"Our commitment to quality begins with our sourcing strategy. We do not manufacture sensors ourselves; instead, we form strategic partnerships with globally respected manufacturers who are specialists in their fields. Our testers are sourced directly from these industry leaders, ensuring that every product we offer is built on a foundation of proven engineering, precision, and reliability. This ""best-of-breed"" approach allows us to provide equipment that meets the rigorous demands of scientific research and education.

This commitment to premium sourcing directly translates to verifiable precision. The data from our instruments is not a general estimate; it is an accurate, instrument-grade measurement. For researchers, this means the data is reliable enough for publication. For educators, it means students are learning correct scientific methodology with data they can trust. Many of our devices feature calibrations traceable to national and international standards (like NIST), providing an unbroken chain of data integrity.

Reliability is another cornerstone of our philosophy. Equipment in an educational setting must withstand demanding use, from inexperienced student handling in a lab to the unpredictable conditions of a field study. Our partners build robust hardware designed for industrial and scientific applications, resulting in a far lower failure rate and a longer operational lifespan. This durability ensures a lower total cost of ownership for your institution.

Finally, our partnerships guarantee compliance. All our equipment adheres to strict environmental and educational standards. This includes critical electrical safety certifications (such as UL, CE, or CSA) required for safe operation in any lab or classroom. It also means compliance with relevant EPA, ISO, and other regulatory protocols for environmental monitoring, ensuring the data you collect is legally and scientifically defensible. This focus on premium, compliant equipment protects your students, your staff, and your institution.",https://enviroeducationtools.com/
